Название;Описание;Цена;Цена до скидки;Фото 1;Фото 2;Фото 3;Категория;Sub category
"LIPOMAP Maharishi Ayurveda (Липомап, снижение уровня холестерина, Махариши Аюрведа), 40 таб.
";"Аюрведический препарат Липомап фирмы Махариши Аюрведа - это уникальный состав на основе растительных и минеральных компонентов служащий для уменьшения высокого уровня холестерина в крови и способствующий похудению.

В основе препарата лежит классическая аюрведическая формула для контроля веса - Медохар гуггул, дополненная и улучшенная растительно-минеральным комплексом.

Холестерин или холестерол - органическое соединение (стероид), природный жирный спирт, содержащийся в клеточных мембранах всех живых организмов. Содержится в большем количестве в тканях животных и пище богатой животными жирами.

Холестерин весьма важный стероид для нашего организма. Он эффективно участвует в процессе переваривания пищи (без него печень не может вырабатывать пищеварительные соли и соки), в выработке мужских и женских половых гормонов (тестостерона, эстрогена, прогестерона). Холестерин способствует выработке надпочечниками кортизола, а в кожном покрове синтезируется витамин Д.

Порядка 75-80% холестерина организм вырабатывает самостоятельно, оставшиеся 20-25% попадают в наш организм вместе с продуктами питания и его уровень может меняться в ту или иную сторону в зависимости от рациона питания.

Существует два типа Холестерина: ""плохой"" и ""хороший"".

""Плохой"" холестерол (низкой плотности), имеет способность оседать на стенках сосудов образовывать бляшки, которые ведут к закупорке кровеносных сосудов и повышают вероятность развития атеросклероза и коронарного заболевания сердца.

В свою очередь, ""хороший"" холестерин имеет высокую плотность (ЛПВД) и иную структуру нежели ""плохой"". Он способен чистить стенки сосудов от ""плохого"" холестерина и отправлять его на дальнейшую переработку в печень.

На сегодняшний день врачи сопоставляют уровень холестерина в крови с питанием и образом жизни.";540;600;https://india-bazar.ru/images/stories/virtuemart/product/lipomap-maharishi-ayurveda-lipomap-cnizhenie-urovnya-kholesterina-makharishi-ayurveda-40-tab57.jpg;https://india-bazar.ru/images/stories/virtuemart/product/lipomap-maharishi-ayurveda-lipomap-cnizhenie-urovnya-kholesterina-makharishi-ayurveda-40-tab.jpg;;Здоровье;Бад
"Очиститель языка медный, Hetvi (12 шт в упаковке)";"Скребок изготовлен из меди и предназначен для повседневного очищения языка от остатков пищи, слизи, налета. Это качественный, достаточно плотный и при этом легкий и гибкий прибор, хорошо удаляющий с языка патогенную слизь, не царапающий, не травмирующий слизистые рта. Пользователи отмечают его высокую эффективность.

";?;;https://jiv-zdrav.ru/wa-data/public/shop/products/00/webp/27/08/20827/images/20271/20271.400.webp;;;Гигиена;Уход за рта
"YOGI KANTHIKA, Yogi Ayurvedic (ЙОГИ КАНТИКА, Драже для лечения горла), 70 шт.
";"Йоги Кантика (Yogi Kanthika) – аюрведическое средство для облегчения состояния при ангине и для снятия боли в горле, которая вызвана фарингитом, тонзиллитом и другими бактериальными инфекциями. Благодаря содержанию в составе имбиря, яштимадху и тулси Йоги Кантика помогает успокоить кашель, устранить першение и раздражение в горле и снять отеки. Эти пастилки можно принимать как при первых признаках простуды, так и при затянувшейся ангине. Средство способствует восстановлению охрипшего голоса, а также освежает дыхание. Йоги Кантика создана исключительно на основе натуральных компонентов, поэтому безопасна для детей.";162;180;https://india-bazar.ru/images/stories/virtuemart/product/nMApqEKM-MM.jpg;;;Здоровье;Уход за рта
"YOGI KANTHIKA, Yogi Ayurvedic (ЙОГИ КАНТИКА, Драже для лечения горла), 140 шт.
";"Йоги Кантика (Yogi Kanthika) – аюрведическое средство для облегчения состояния при ангине и для снятия боли в горле, которая вызвана фарингитом, тонзиллитом и другими бактериальными инфекциями. Благодаря содержанию в составе имбиря, яштимадху и тулси Йоги Кантика помогает успокоить кашель, устранить першение и раздражение в горле и снять отеки. Эти пастилки можно принимать как при первых признаках простуды, так и при затянувшейся ангине. Средство способствует восстановлению охрипшего голоса, а также освежает дыхание. Йоги Кантика создана исключительно на основе натуральных компонентов, поэтому безопасна для детей.";216;240;https://india-bazar.ru/images/stories/virtuemart/product/yogi-ayurvedic-yogi-kanthika-jogi-kantika-drazhe-dlya-lecheniya-gorla-140-sht.jpg;;;Здоровье;Уход за рта
"Al-Rehab Concentrated Perfume SECRET LADY (Масляные арабские духи СЕКРЕТ ЛЕДИ Аль-Рехаб), 6 мл.
";"Пол: Женский
Классификация аромата: восточный; пряный; цветочный.

d Верхние ноты: цветочный букет, нежные травяные мотивы
d Ноты сердца: корица, ваниль
d Базовые Ноты: пряности, лемонграсс.

Масляные духи Secret Lady Al Rehab (Секрет Леди Аль Рехаб) имеют нежный оттенок душистых весенних цветов и лёгкий сладковатый привкус спелых фруктов и ванили. Арабские масляные духи - это духи для загадочных особ, имеющих свой маленький секрет.

Состав: Parfum, Hydroxycitronellal, Limonene, Coumarin, Linallol.

Страна производства: ОАЭ";162;180;https://india-bazar.ru/images/stories/virtuemart/product/arabskie-maslyanye-duhi-secret-lady-6-ml-al-rehab-zhenskij.jpg;;;Парфюмерия;Духи
"Al-Rehab Concentrated Perfume LOVELY (Масляные арабские духи ЛАВЛИ, Аль-Рехаб), 6 мл.
";"Пол: женский
Классификация аромата: Зеленые, Цветочные

d Верхние ноты: Айва, Травяные ноты, Цитрусовые ноты
d Средние ноты: Айва, Травяные ноты, Цитрусовые ноты
d Базовые ноты: Амбра, Белый мускус, Сандал

Прекрасный аромат для женщин - чарующий и манящий аромат. Масляные духи Lovely Al-Rehab это утонченный, чуть сладковатый запах, с тёплыми оттенками ванили и пудры. Прекрасные верхние ноты духи Лавли Аль Рехаб составляют аромат цветов айвы, магнолии, бергамот и ноты свежей зелени. Основные ноты масляные духи Лавли Аль Рехаб: ночной жасмин, белые цветы, цветы апельсина, белый персик. А “шлейф” духи для женщин Lovely Al-Rehab это аромат древесины и амбра. Духи Lovely Al-Rehab являются масляными духами, то есть они состоят из натуральных экстрактов масел и в их состав не входит спирт.

Состав: Parfum, Benzyl Salicyltae, Butylphenyl Methylpropional, Hydroxycitronellal, Limonene, Linalool, Citronellol, HexylCinnamal, Geraniol, Citral, Alpha-Isomethyl Ionone.

Страна производства: ОАЭ";162;180;https://india-bazar.ru/images/stories/virtuemart/product/2549-duhi-al-rehab.jpg;;;Парфюмерия;Духи
"Al-Rehab Concentrated Perfume SULTAN AL OUD (Масляные арабские духи СУЛТАН АЛ УД (унисекс) Аль-Рехаб), 6 мл.
";"Пол: Унисекс
Группа аромата: Древесные, Кожаные

d Начальные ноты: агаровое дерево, цветы.
d Ноты сердца: сладость жасмина, амбра, искристый лимон.
d Заключительные ноты: сладкая и тёплая ваниль, пряный мускус..

Sultan Al Oud - согревающая и уютная композиция, достойная самого султана.

Арабский бренд Al-Rehab создал удивительный аромат, который великолепно подойдет для холодного времени года. Его композиция отличается особой уютностью, привлекательностью и комфортом, она обладает согревающим и чарующим действием, что точно никого не оставит равнодушным!

Началом ароматного букета служат сплетения древесных, а также цветочных оттенков, а по истечении некоторого времени к ним присоединяются аккорды жасмина, амбры и лимонная кислинка. В финале солируют ноты ванили и мускуса, в результате чего образуется ориентальный аромат, обладающий особой многогранностью и заманчивостью. Его теплота и очарование безупречно подойдут как мужчинам, так и женщинам, раскрывая в своем носителе доброту, нежность, а также особый шарм.

Sultan Al Oud - это аромат унисекс, который подойдет людям различного возраста, а идеальным временем года для его ношения является зима, которая окажется не такой уж и холодной в компании этой удивительной и уникальной парфюмерной композиции!";227;253;https://india-bazar.ru/images/stories/virtuemart/product/al-rehab-concentrated-perfume-oil-sultan-al-oud-by.jpg;;;Парфюмерия;Духи
"Al-Rehab Concentrated Perfume SOFT (Масляные арабские духи СОФТ Аль-Рехаб), 6 мл.
";"Пол: женский
Группа ароматов: Гурманские, Сладкие, Цветочные

d Верхние ноты: Ваниль, Жасмин, Орхидея, Пачули, Роза
d Средние ноты: Ваниль, Ветивер, Карамель, Цитрусовые нюансы
d Базовые ноты: Белый мускус, Древесные ноты

Масляные духи Soft от арабской компании Al Rehab – это мягкий, обволакивающий, сладостный аромат для нее. Он полностью оправдывает свое название «Soft», что значит мягкий, нежный, не душит резкостью, а мягко ложится на кожу нежным облаком.
«Soft» от Аль Рехаб подойдет для любителей сладостей, он напоминает ароматную сладкую вату, сахарную карамель которая переплетается с цветочной вуалью и оканчивается теплыми древесными нотками.

Состав: Parfum, Hexyl Cinnamal, Benzyl Benzoate, Limonene, Coumarin, Linalool, Alpha-Isomethyl Ionone, Citral, Geraniol, Citronellol, Eugenol. Духи из натуральных экстрактов и масел. В состав не входит спирт.

Страна производства: ОАЭ";162;180;https://india-bazar.ru/images/stories/virtuemart/product/soft6mlrehab1-800x800.jpg;;;Парфюмерия;Духи
"Al-Rehab Concentrated Perfume DALAL (Масляные арабские духи ДАЛАЛ (унисекс) Аль-Рехаб), 6 мл.
";"Пол: унисекс
Классификация аромата: Гурманские, Древесные, Сладкие

d Верхние ноты: Апельсин
d Средние ноты: Апельсин, Ваниль, Карамель
d Базовые ноты: Мускус, Сандал

Масляные духи ""Далал"" фирмы Аль Рехаб - это завораживающий аромат, сочетающий в себе фруктовую сладость с цветочным великолепием жасмина и ванили, который отлично подойдёт как мужчинам, так и женщинам.
Этот аромат весьма разносторонен: юной девушке он придаёт нежности и романтичности, женщине - привлекательность и сексуальность, мужчине - силы и обольщение.
Масляные духи Al-Rehab Dalal представляют композицию ориентально-цветочных оттенков с тёплыми древесными нотами сандала и лёгкой цитрусовой сладостью апельсина.
Цветочный аромат исполнен, согласно современным модным тенденциям, с тонизирующими цитрусовыми нотами, но при этом сохраняет классические оттенки.Начальной нотой композиции является энергичный заряд оптимизма цитрусового аккорда, хорошо подходящий людям смелым и неординарным. Обрамляет цитрусы манящий и околдовывающий аромат сладкой карамели. Сердцем аромата является настоящий летний подарок - сексуальная нота пленительной ванили.
Шлейф, оставляемый ароматом, представлен благородным и изысканным сандалом, которая даёт стойкость композиции, даря ей глубину и соблазнительность, особую чувственности и сексуальности.Духи подойдут для ежедневного использования и для вечернего раута.";162;180;https://india-bazar.ru/images/stories/virtuemart/product/al_rehab_dalal.jpg;;;Парфюмерия;Духи
"Al-Rehab Concentrated Perfume ZAHRAT HAWAII (Масляные арабские духи ЗАХРАТ ГАВАЙИ Аль-Рехаб), 6 мл.
";"Пол: унисекс
Тип аромата: Древесный, Цветочный, Восточный

d Верхние ноты: ананас, кокос, манго, персик.
d Ноты сердца: клубника, папайя, экзотические цветы.
d Базовые ноты: древесный, цитрусовый.

Аттар Захрат Гавайи (Zahrat Hawaii) - лёгкий аромат гавайского бриза с нотками тропических цветов в сочетании со сладостью ванили, клубники и кокоса. Небольшой оттенок терпкости этим арабским масляным духам Аль Рехаб придаёт белый мускус и миндаль. Арабские духи купить для женщин здесь. Арабские маслянные духи Захрат Гавайи (Zahrat Hawaii) - аромат для утончённых персон.

Состав: parfum, Alpha-Isomethyl Ionone, Linalool, Citronellol, Coumarin, Geraniol, Eugenol, Citral

Страна производства: ОАЭ";162;180;https://india-bazar.ru/images/stories/virtuemart/product/zahrat-hawaii-800x800-768x768.jpg;;;Парфюмерия;Духи
"Al-Rehab Concentrated Perfume 1975 (Масляные арабские духи 1975 (унисекс) Аль-Рехаб), 6 мл.
";"Пол: унисекс
Классификация аромата: Древесные, Цитрусовые

d Верхние ноты: Апельсин, Бергамот, Гиацант
d Средние ноты: Гардения, Жасмин, Роза
d Базовые ноты: Амбра, Мускус, Сандал

1975 от Al Rehab – это благородный, строгий и красивый аромат для него и для нее. Медленно раскрывается на коже ориентальными и древесными мотивами.

Духи «1975» от Аль Рехаб понравятся любителям свежих, бодрящих композиций, серьезным, деловым и уверенным в себе людям, любящим спортивный, строгий стиль в одежде. Прекрасно звучит в любую погоду и оставляет легкий шлейф. Духи 1975 от Аль Рехаб продаются в компактном, стеклянном флаконе, имеют роликовый аппликатор. Обладают хорошей стойкостью и экономны в расходе.

Способ применения. Наносите духи на чистую кожу с помощью роликового аппликатора. Для лучшего звучания аромата, нанесите его на запястья, за ушами, на шею и сгиб локтя.

Состав: Parfum, Benzyl Salicylate, Limonene, Coumarin, Linalool, Butylphenyl Methylpropional, Citronellol, Geraniol, Alpha-Isomethyl ionone, Citral, Eugenol.

Страна производства: ОАЭ";162;180;https://india-bazar.ru/images/stories/virtuemart/product/image1975.jpg;;;Парфюмерия;Духи
"Al-Rehab Concentrated Perfume JASMIN (Масляные арабские духи ЖАСМИН Аль-Рехаб), 6 мл.
";"Пол: унисекс
Классификация аромата: восточный; мускусный; цветочный

d Верхние ноты: жасмин
d Средние ноты: мускус
d Базовые ноты: мускус

Масляные духи Jasmin Al Rehab с роскошным ароматом жасмина вернет вас в теплую весну с одурманивающим благоуханием цветов и свежей зелени. Это традиционный аромат настоящего востока, отличающийся насыщенностью и стойкостью. Он подойдет сильным энергичным личностям. Считается универсальным парфюмом, который можно применять как мужчинам, так и женщинам.

Состав: Parfum, Citronellol, Alpha-Isomethyl Ionone, Limonene, Geraniol, Linalool, Citral, Eugenol, Isoeugenol, Hexyl Cinnamal, Benzyl Benzoate, Farnesol, Benzyl Salicylate. Духи из натуральных экстрактов и масел. В состав не входит спирт.

Страна производства: ОАЭ";227;253;https://india-bazar.ru/images/stories/virtuemart/product/15168549-3-logo.jpg;;;Парфюмерия;Духи
"Al Rehab Арабские Масляные духи Choco Musk, 6 мл
";"Choco Musk от бренда Al Rehab Perfumes из ОАЭ по лояльной цене - со скидками для новых и постоянных покупателей. Изысканный восточный парфюм, который звучит одновременно просто и загадочно, можно успеть заказать по самой низкой цене. Яркий, насыщенный аромат масляных арабских духов относится к категории унисекс, предназначается для него и для нее. Шоколадно-ванильный шлейф Чоко Муск от Аль Рехаб способен окутать непредсказуемыми нотками сладкой выпечки, ванили и шоколада. К верхним нотам относится шоколад и белый мускус. Сердце аромата раскрывается ванилью, розой, корицей. В базовые ноты входит амбра, мирра, пряности, сандал. На разных типах кожи аромат масляных духов раскрывается по-разному, и каждый раз звучит очень красиво. Масляные духи Чоко Муск от Аль Рехаб подходят для прохладного времени года, идеальны для романтических встреч, вечерних прогулок. Духи женские, мужской парфюм - идеальный подарок на любой праздник.

";230;;https://sun9-26.userapi.com/impf/c852224/v852224234/15ff7a/wIePFMM1ZwM.jpg?size=474x604&quality=96&sign=7496314b0a0124f019a6b06517f99837&type=album;;;Парфюмерия;Духи
