Название;Описание;Цена;Цена до скидки;Фото 1;Фото 2;Фото 3;Категория;Sub category
"Baidyanath CHYAWANPRASH Special (Чаванпраш Особый, Бадьянатх), 500 г.
";"Чаванпраш – это сбалансированный аюрведический джем из плодов индийского крыжовника – амлы, вываренных в тростниковом сахаре. Сок Амлы в 20 раз превышает содержание витамина С в апельсиновом соке, что объясняет столь высокую пользу этого плода для организма человека. Продукт представляет собой многокомпонентную обогащенную витаминами и минералами биологически активную смесь из абсолютно натурального и свежего сырья, среди которого ягоды, плоды, коренья, природный кальций, золото и серебро. Таким образом, это универсальный продукт для оздоровления всего организма, который содержит в себе все 6 качеств вкуса по Аюрведе: сладкий, горький, кислый, острый, соленый, вяжущий. Чаванпраш является абсолютно безопасным даже для детского организма.

На протяжении многих веков это средство используется для активизации иммунной системы человека через увеличение репродукции иммунных клеток. Уже после довольно непродолжительного приёма Чаванпраша, Вы сможете ощутить, что Ваша сопротивляемость вирусам и инфекциям заметно возросла, а при регулярном и длительном приёме и вовсе не возникает никаких проблем со здоровьем. Ведь ни для кого не секрет, что иммунитет — это залог хорошего самочувствия и долголетия человека.

Целебная сила трав, кореньев и плодов, собранных в экологически чистых районах Гималаев, служит надёжной опорой здоровью тела и духа человека. Она обеспечивает защиту организма от неблагоприятных последствий, вызванных капризами погоды, загрязнением и отравлением окружающей среды, при повышенной радиоактивности и электромагнитным излучением,служит мерой профилактики инфаркта, инсульта, развития опухолевых процессов и других дегенеративных изменений тканей организма.

Данный продукт нормализует обмен веществ, укрепляет иммунную и эндокринную системы, регулирует деятельность желудочно-кишечного тракта, улучшает перистальтику кишечника. Дает заряд бодрости на весь день, делает организм более выносливым к умственным и физическим нагрузкам. Помогает лучше запоминать информацию, стимулирует работу головного мозга. Снимает стресс и помогает при депрессии. Помогает восстановиться после операций и тяжелых заболеваний.

Чаванпраш является итогом поиска эликсира человечества бессмертия, источника свободы от недугов и старения. Ведь благодаря своим ценным питательным свойствам, омолаживающему и общему оздоравливающему воздействию на тело и ум индусы дали продукту название «Эликсир жизни» и «Бальзам вечной молодости».";896;996;https://india-bazar.ru/images/stories/virtuemart/product/baidyanath-chyawanprash-avaleha-special-chavanprash-avalekha-osobyj-badyanatkh-500-g2.jpg;https://india-bazar.ru/images/stories/virtuemart/product/baidyanath-chyawanprash-avaleha-special-chavanprash-avalekha-osobyj-badyanatkh-500-g1.jpg;https://india-bazar.ru/images/stories/virtuemart/product/44765EB2-F1AF-4C77-9072-D5E788F91A24.jpg;Здоровье;Бад
"Baidyanath CHYAWAN-VIT Sugar Free (Чаванпраш Чван-Вит без сахара с шафраном, миндалём и ашвагандхой, Бадьянатх), 500 г.
";"Чаванраш Байдьянатх без сахара (Baidyanath Chyawan Vit Sugafree) - это известный эликсир здоровья и долголетия в маленькой чайной ложке! Чаванраш Байдьянатх без сахара является уникальным аюрведическим тоником, соединяющий в себе пользу 52 природных ингредиентов, собранных вручную и объединенных в один продукт для универсального насыщения организма целым комплексом витаминов и минералов, увеличения силы и выносливости, повышения жизненной энергии и продления молодости.
Чаванраш Байдьянатх производится вот уже более 85 лет в полном соответствии с методиками, описанными в древних тестах Аюрведы. Чаванраш Байдьянатх без сахара наполнен силой витамина C и натурального кальция, а также уникальными лечебными свойствами шафрана, шатавари и ашвагандхи. Этот продукт поможет естественным образом укрепить иммунитет, повысить защитные функции организма, а также улучшить устойчивость к инфекционным и хроническим заболеваниям, простудам, вирусам, неблагоприятным факторам окружающей среды.

Чаванраш является безусловным помощником и поддержкой в жизненные периоды, когда организму не хватает собственных внутренних ресурсов для сохранения нормального энергетического уровня и здоровья: в периоды повышенного стресса, высоких физических, эмоциональных, психологических нагрузок, при восстановлении после травм и заболеваний, в периоды межсезонья, перегрузки на работе или учебе.

Препарат действует как антистрессовый агент, способствуя расслаблению и уменьшению напряжения, оказываемого на нервную систему человека, помогая формировать здоровую реакцию в сложных жизненных ситуациях.

Чаванпраш стимулирует процесс очищения кровеносной системы, ускоряя вывод токсинов из организма, нормализует работу внутренних органов и стабилизирует обменные процессы организма, гарантирует бесперебойную деятельность всех основных систем жизнедеятельности человека.

Препарат также является известным аюрведическим тоником, продлевающим молодость и дарящим долголетие. Согласно древним аюрведическим трактатам, Чаванпраш считается одной из главных расаян, способствующей полному омоложению организма, избавлению от возрастных заболеваний и хворей, поднимающей жизненный тонус и потенцию человека, улучшающую память и умственную деятельность, способствующую развитию внимательности и концентрации.";1015;1128;https://india-bazar.ru/images/stories/virtuemart/product/chyawan-vit-sugar-free-baidyanath-chavanprash-chvan-vit-bez-sakhara-s-shafranom-mindaljom-i-ashvagandkhoj-badyanatkh-500-g.jpg;;;Здоровье;Бад
"KESARI KALP Royal Chyawanprash Baidyanath (КЕСАРИ КАЛЬП, Королевский чаванпраш с Золотом, Серебром и Шафраном, Бадьянатх), 500 г.
";"Чаванпраш – это сбалансированный аюрведический джем, энерготоник и иммуномодулятор, созданный из натуральных ингредиентов с использованием золота, серебра и шафрана в комбинации с травами. Это истинный эликсир долголетия, способный повысить иммунитет и омолодить организм!

Чаванпраш изготавливается из плодов индийского крыжовника – амлы, вываренных в тростниковом сахаре, с добавлением целебных трав и минералов. Сок амлы в 20 раз превышает содержание витамина С в апельсиновом соке, благодаря чему она является частым ингредиентом аюрведических средств. В его состав входят 48 компонентов, которые собираются и особым образом перерабатываются согласно древним традициям Аюрведы, но с использовании современных технологий, что гарантирует его высокое качество. При рассасывании Чаванпраша можно почувствовать все 6 вкусов: сладкий, горький, кислый, острый, соленый, вяжущий.

Чаванпраш - чрезвычайно энергонасыщенный продукт, чья биологическая активность составляет 200 единиц, в то время как, например, активность корня женьшеня только 120 единиц. Он даёт заряд бодрости на весь день, делает организм более выносливым к умственным и физическим нагрузкам. Помогает лучше запоминать информацию, стимулирует работу головного мозга. Повышает уровень гемоглобина.

Все эти свойства делают Чаванпраш мощным энерготоником и иммуномодулятором, созданный из натуральных трав и минералов. За свою способность омолаживать организм он получил название в древних аюрведических трактатах «бальзам вечной молодости».

Это очень действенное средство для улучшения иммунитета, благодаря чему используется для профилактики и лечения простудных и вирусных заболеваний.

Кроме того, продукт нормализует обмен веществ, укрепляет эндокринную систему, регулирует деятельность желудочно-кишечного тракта, улучшает перистальтику кишечника.

Он снимает стресс и помогает при состояниях депрессии, существенно улучшая настроение. Способствует ускорению восстановления после операций и хронических заболеваний. Эффективен при профилактике инфаркта, инсульта и рака. Чаванпраш пользуется особой популярностью у спортсменов для повышения выносливости и восстановления сил, а также у родителей – Он обладает сладким вкусом, из-за чего даже маленькие дети с удовольствием его принимают, получая необходимый запас витаминов. Особенно полезен Чаванпраш людям, проживающим в экологически неблагоприятных условиях, зонах с повышенной радиоактивностью и электромагнитным излучением.

Чаванпраш Кесари Кальп имеет мягкий и сладкий вкус, который понравится не только детям, но и взрослым! ";1620;1800;https://india-bazar.ru/images/stories/virtuemart/product/kesari-kalp-royal-chyawanprash-baidyanath-kesari-kalp-korolevskij-chavanprash-s-zolotom-serebrom-i-shafranom-badyanatkh-500-g.jpg;;;Здоровье;Бад
"COW's GHEE Patanjali (Топленое коровье масло ГХИ (Ги), Патанжали), 500 мл.
";"Гхи – очищенное топленое коровье масло. В Индии его не зря называют «жидким золотом» за широкий спектр целебных свойств.

С давних времен в Индии масло гхи считалось очень ценным продуктом наряду с зерном и золотом. Оно использовалось для проведения огненных церемоний подношений, его лили в огонь, произнося определенные мантры для достижения благополучия и процветания.

Топленое масло – антиоксидант, защищает организм от вредных радикалов, продлевает молодость, сохраняет красоту, улучшает зрение, усиливает иммунитет. А также ускоряет обмен веществ, улучшает пищеварение и восстанавливает процессы усвоения пищи. Снимает стресс и напряжение. Гхи подходит абсолютно всем и балансирует все три доши.

Масло гхи стимулирует огонь пищеварения, очень полезным считается его применение для приготовления пищи. Гхи имеет высокую температуру сгорания, поэтому пища, приготовленная на нем, не подгорает, а блюда приобретают ни с чем не сравнимые вкус и аромат. Такая пища считается диетической.

Гхи – источник очищающей огненной энергии. Оно наполняет очищает ум на тонком плане, влияет на ясность мыслей, формирует правильные желания, укрепляет память.

Гхи существенно отличается от простого топленого масла. В приготовлении гхи используется только натуральное сливочное масло, которое выпаривают на водяной бане в течение нескольких часов при строгом соблюдении технологии. В процессе выпаривания масло очищается от вредных примесей, в том числе в правильно приготовленном гхи отсутствует лактоза. Такое масло долгое время не портится, срок хранения более года. Качественное гхи имеет насыщенный ярко-желтый цвет и приятный аромат.

Гхи содержит ненасыщенные жирные кислоты (35%) с короткой химической связью, что позволяет маслу легко усваивается в организме, не создавая вредный холестерин.

Масло гхи богато важными для здоровья микроэлементами. Содержит натрий, калий, кальций, фосфор, магний, железо, а также витамины А (снижает риск атеросклероза) и Е (антиоксидант); линолевую кислоту (развитие органов и тканей), никотиновую кислоту.";1044;1344;https://india-bazar.ru/images/stories/virtuemart/product/cows-ghee-patanjali-toplenoe-korove-maslo-gkhi-gi-patanzhali-500-ml.jpg;;;Продукты питания;Масло
"AGASTYA RASAYANAM Kottakkal Ayurveda (Агастья Расаянам, лечение респираторных заболеваний, Коттаккал Аюрведа), 200 г.
";"Агастья Расаянам - эффективное средство для лечения респираторных заболеваний.

Практически все жители больших городов имеют те иные проблемы с легкими. Даже если кажется, что с органами дыхания все в порядке - это в не так. В них постоянно оседает смог, который не так-то легко вывести, и который влияет на состояние нашего здоровья в целом. В гораздо более худшей ситуации находятся те, кто страдает от астмы, кашля, в том числе и аллергического, бронхита, простуды и других заболеваний, связанных с легкими, а также курильщики. Более того, можно сказать, что это средство просто жизненно необходимо курильщикам.

Препарат облегчит состояние и при более тяжелых заболеваниях, вплоть до астмы. Он убивает бактерии и вирусы, разжижает мокроту, выводит из организма вредные вещества, улучшает состояние сердечно-сосудистой системы, оказывает согревающее воздействие.

Агастья Расаянам не просто способствует укреплению иммунитета, но и помогает избавиться от симптомов гриппа, простуды, ОРВИ. Его также очень хорошо использовать в качестве профилактического средства, чтобы защитить себя и своих детей в сезон простуд.

Также оно тонизирует организм при упадке сил и значительно улучшает пищеварение. Поэтому данный препарат аюрведические врачи часто прописывают пожилым людям, а также для укрепления организма после больших нагрузок и при истощения. Он также улучшает состояние при анорексии, способствуя хорошему аппетиту.";476;520;https://india-bazar.ru/images/stories/virtuemart/product/agastya-rasayanam-kottakkal-ayurveda-agastya-rasayanam-lechenie-respiratornykh-zabolevanij-kottakkal-ayurveda-200-g.jpg;;;Здоровье;Бад
"FOOT CARE CREAM Turmeric, Himalaya (ФУТКЕА, Крем для ухода за кожей стоп с куркумой, Хималая), 20 г.
";"Аюрведический крем для кожи ног - средство, которое эффективно смягчает и разглаживает сухую, загрубевшую и потрескавшуюся кожу ступней ног. Нежная текстура крема, глубоко проникая в кожу, смягчает обезвоженную кожу стоп, способствует заживлению трещин и снимает воспаления.

Комбинация произрастающих в Индии лечебных, таких как пажитник, шорея, куркума с добавлением мёда оказывают выраженное антисептическое, бактерицидное и противовоспалительное воздействие, активно восстанавливают кожу. При регулярном применении крема они поддерживают ступни гладкими и мягкими.

Крем оказывает бережное отшелушивающее воздействие, благодаря чему кожа на ногах постепенно обновляется, становится более эластичной и приятной на ощупь. Он также способствует нормализации процесса регенерации и оказывает успокаивающий эффект на кожу, снимает покраснения и раздражения.";162;180;https://disk.yandex.ru/d/H8vPocFHGu1ZZQ/Himalaya%20cosmetics/IMG_0100.jpg;;;Красота;Уход за телом
